{
  "directive_id": "01ARZ3NDEKTSV4RRFFQ69G5FA1",
  "parent_id": "01ARZ3NDEKTSV4RRFFQ69G5FA0",
  "intent": "create_task",
  "entities": [
    {"entity_type": "task", "entity_id": "01ARZ3NDEKTSV4RRFFQ69G5FA2"}
  ],
  "due_date": "2026-05-15",
  "status": "created",
  "source_worklog_id": "01ARZ3NDEKTSV4RRFFQ69G5FA3",
  "source_rule_ids": ["01ARZ3NDEKTSV4RRFFQ69G5FB1", "01ARZ3NDEKTSV4RRFFQ69G5FB2"],
  "source_document": "Daily standup notes from 2026-04-22",
  "created_at": "2026-04-22T09:30:00Z",
  "updated_at": "2026-04-22T10:00:00Z"
}
